"According to Dane Ortlund in Gentle and Lowly, “One of the more neglected doctrines in the church today is the heavenly intercession of Christ,” that is, “what Jesus is doing now,” because we might think that “everything we need to be saved is already accomplished.”","Menurut Dane Ortlund dalam Gentle and Lowly, “Salah satu doktrin yang lebih sering diabaikan di gereja saat ini adalah pengantaraan surgawi Kristus,” yaitu, “apa yang Yesus lakukan sekarang,” karena kita mungkin berpikir bahwa “semua yang kita butuhkan untuk diselamatkan telah selesai dilakukan.”"
"Of course, this doesn’t mean something was left unfinished in Christ’s atoning work on the cross, but as Calvin says, in his intercession, Christ never ceases to “turn the Father’s eyes to his own righteousness and to avert his gaze from our sins,” because we are in the state of sinfulness on earth.","Tentu saja, ini tidak berarti ada sesuatu yang belum selesai dalam pekerjaan pendamaian Kristus di kayu salib, tetapi seperti yang dikatakan Calvin, dalam pengantaraan-Nya, Kristus tidak pernah berhenti untuk “mengalihkan mata Bapa kepada kebenaran-Nya sendiri dan mengalihkan pandangan-Nya dari dosa-dosa kita,” karena kita berada dalam keadaan berdosa di bumi."
"In short, part of Jesus’ heavenly ministry is to pray for us, which recalls what he said to Peter the night he was betrayed, “Simon, Simon, behold, Satan demanded to have you, that he might sift you like wheat, but I have prayed for you that your faith may not fail. And when you have turned again, strengthen your brothers” (Lk 22:31-32).","Singkatnya, bagian dari pelayanan surgawi Yesus adalah untuk berdoa bagi kita, yang mengingatkan kita pada apa yang Dia katakan kepada Petrus pada malam Dia dikhianati, “Simon, Simon, lihatlah, Iblis telah menuntut untuk menampi kamu seperti gandum, tetapi Aku telah berdoa untukmu supaya imanmu jangan gugur. Dan jika engkau sudah insaf, kuatkanlah saudara-saudaramu” (Luk 22:31-32)."
"Ortlund takes it a step further by pointing us to an even more comforting truth, that is, Jesus is not only an intercessor, but also an advocate, as the apostle John says in 1 John 2:1, “My little children, I am writing these things to you so that you may not sin. But if anyone sin, we have an advocate with the Father, Jesus Christ the righteous.”","Ortlund melangkah lebih jauh dengan menunjukkan kepada kita kebenaran yang bahkan lebih menghibur, yaitu, Yesus bukan hanya seorang pengantara, tetapi juga seorang pembela, seperti yang dikatakan rasul Yohanes dalam 1 Yoh 2:1, “Anak-anakku, hal-hal ini kutuliskan kepada kamu, supaya kamu jangan berbuat dosa. Namun, jika seorang berbuat dosa, kita mempunyai seorang pengantara pada Bapa, yaitu Yesus Kristus yang adil.”"
If “an intercessor stands between two parties; an advocate doesn’t simply stand in between the two parties but steps over and joins the one party as he approaches the other.”,Jika “seorang pengantara berdiri di antara dua pihak; seorang pembela tidak hanya berdiri di antara dua pihak tetapi melangkah lebih jauh dan bergabung dengan satu pihak saat dia mendekati pihak lainnya.”
"For that reason, “intercession is something Christ is always doing, while advocacy is something he does as occasion calls for it.” He intercedes in our general sinfulness even as saints, but he advocates in case we sin big time, so that we don’t give up as we are comforted more in times of failure.","Oleh karena itu, “pengantaraan adalah sesuatu yang selalu Kristus lakukan, sementara pembelaan adalah sesuatu yang Dia lakukan ketika keadaan memanggilnya.” Dia menjadi pengantara dalam dosa kita secara umum bahkan sebagai orang kudus, tetapi Dia menjadi pembela jika kita melakukan dosa besar, sehingga kita tidak menyerah dan mendapatkan penghiburan lebih besar di saat kegagalan."
"Why do we need both intercession and advocacy? Other than to make us right with God, it is also because of the accusations hurled at us by Satan the accuser, who accuses us day and night before our God (Rev 12:10), so that we might be discouraged.","Mengapa kita membutuhkan pengantaraan dan pembelaan? Selain untuk membuat kita benar di hadapan Allah, juga karena tuduhan yang dilontarkan kepada kita oleh Iblis si penuduh, yang menuduh kita siang dan malam di hadapan Allah kita (Why 12:10), sehingga kita bisa kehilangan semangat."
"How then do we overcome such accusatory attacks? The answer is found in Rev 12:11. First, we conquer Satan by the blood of the Lamb; second, we conquer Satan by the word of our testimony; third, we conquer Satan by not fearing death.","Lalu bagaimana kita mengatasi serangan tuduhan seperti itu? Jawabannya ada di Why 12:11. Pertama, kita mengalahkan Iblis dengan darah Anak Domba; kedua, kita mengalahkan Iblis dengan perkataan kesaksian kita; ketiga, kita mengalahkan Iblis dengan tidak takut akan kematian."
"Christ has done the first for us on the cross in his earthly ministry, followed up by his heavenly ministry of intercession and advocacy. For the second and the third, we need to familiarize ourselves with the gospel of Christ in order to bear testimony to Christ and to love him more than our life.","Kristus telah melakukan yang pertama bagi kita di kayu salib dalam pelayanan-Nya di dunia, diikuti oleh pelayanan surgawi-Nya sebagai pengantara dan pembela. Untuk yang kedua dan ketiga, kita perlu mengenal Injil Kristus dengan lebih baik untuk memberikan kesaksian tentang Kristus dan mengasihi-Nya lebih dari hidup kita."
"Just now I promoted heavily Dane Ortlund’s Gentle and Lowly for us to know Christ and his work better, now I want to hard sell Don Carson’s For the Love of God, the two-volume devotional Bible commentary which I mentioned earlier, for us to know the gospel better.","Barusan saya banyak mempromosikan Gentle and Lowly karya Dane Ortlund agar kita lebih mengenal Kristus dan karya-Nya, sekarang saya ingin mempromosikan buku For the Love of God karya Don Carson, komentar Alkitab harian dua volume yang saya sebutkan sebelumnya, agar kita lebih mengenal Injil."
I have promoted it in Agape in-person and in Christos through social media. Now I would like to encourage the whole church to make use of Carson’s book for our growth in spiritual walk with Jesus.,Saya telah mempromosikannya secara langsung di Agape dan di Christos melalui media sosial. Sekarang saya ingin mendorong seluruh gereja untuk menggunakan buku Carson untuk pertumbuhan kita dalam perjalanan rohani bersama Yesus.
"You don’t need to buy the books, just sign up at www.thegospelcoalition.org for Read the Bible, and you will receive it in your email inbox daily.","Anda tidak perlu membeli buku tersebut, cukup mendaftar di www.thegospelcoalition.org untuk program Read the Bible, dan Anda akan menerimanya setiap hari di kotak masuk email Anda."
,
Conclusion,Kesimpulan
"As 2025 is around the corner, we are being reminded again of the important doctrines of the resurrection and the ascension.","Saat tahun 2025 semakin mendekat, kita diingatkan kembali akan doktrin penting tentang kebangkitan dan kenaikan."
"Both doctrines encourage us to seek transformation by the power of the resurrection, but if we fail, we have an intercessor and an advocate who prays for us.","Kedua doktrin ini mendorong kita untuk mencari transformasi melalui kuasa kebangkitan, tetapi jika kita gagal, kita memiliki seorang pengantara dan seorang pembela yang berdoa untuk kita."
May we step into 2025 with more love for our Lord and his word by reading it daily.,Kiranya kita melangkah ke tahun 2025 dengan lebih banyak kasih kepada Tuhan kita dan firman-Nya dengan membacanya setiap hari.
